{
  "$schema": "../schemas/build-lock.schema.json",
  "lockVersion": 1,
  "algorithm": "SHA256",
  "mode": "verify",
  "generatedBy": "win11-image-kit",
  "entries": [
    {
      "path": "manifests/capability-registry.json",
      "category": "manifest",
      "required": true,
      "hash": "cfd7dd56b2844601bbaf532f2dd2eebf40621ad3fb81f48dff2b2f5e4cb390cd",
      "reason": "Capability registry is a supply-chain control plane input."
    },
    {
      "path": "schemas/capability-registry.schema.json",
      "category": "schema",
      "required": true,
      "hash": "bc619fd8f099a18b47ff136e7728dcc273876d2cb8f571df2d193be3e8367ed1",
      "reason": "Capability registry schema constrains supply-chain metadata."
    },
    {
      "path": "manifests/context-scope.json",
      "category": "manifest",
      "required": true,
      "hash": "8f3621d8e3fd87efaa55e2f541624d95b00775f7b98e0c94c9b9a01a3764da7e",
      "reason": "Context scope manifest is a trusted routing input."
    },
    {
      "path": "schemas/context-scope.schema.json",
      "category": "schema",
      "required": true,
      "hash": "adc78103ca7fbb83e2f4b7dd680334d2aa73f1c38a775cdebc0f9c6f6ae40103",
      "reason": "Context scope schema constrains routing input structure."
    },
    {
      "path": "manifests/sysprep-appx-gate.json",
      "category": "manifest",
      "required": true,
      "hash": "52a1b556f110d790a35f87dde62250613d0d95c5460c40621d3cd1f239386b0d",
      "reason": "Sysprep AppX gate manifest is a trusted readiness input."
    },
    {
      "path": "schemas/sysprep-appx-gate.schema.json",
      "category": "schema",
      "required": true,
      "hash": "a4324cc705b0ba57868f1bce57d3c6b45cd31062120c33354f38f87eae58ab00",
      "reason": "Sysprep AppX gate schema constrains readiness input structure."
    },
    {
      "path": "schemas/build-lock.schema.json",
      "category": "schema",
      "required": true,
      "hash": "a8bcb03d90d55290112d78177e21f662243999b9de63df35509057a5dd05747c",
      "reason": "Build lock schema constrains immutable input lock metadata."
    },
    {
      "path": "scripts/validate/Test-CapabilityRegistry.ps1",
      "category": "script",
      "required": true,
      "hash": "7d0d55509166deb938e704b923359fcf8b2715c5029df38f454278d05dff436a",
      "reason": "Capability registry validation is part of supply-chain consistency checks."
    },
    {
      "path": "scripts/validate/Test-ContextScope.ps1",
      "category": "script",
      "required": true,
      "hash": "e00e7fbda8936b4eba51292753c3ec32ecbe53b3ae21849cff6a219684297722",
      "reason": "Context scope validation is a trusted static guardrail."
    },
    {
      "path": "scripts/validate/Test-SysprepReadiness.ps1",
      "category": "script",
      "required": true,
      "hash": "54b1cf7d2e24dc93911e48d3341fbe6cb4cf0a41c5e9a25a70cbdd68177c59b9",
      "reason": "Sysprep readiness validation is a trusted static guardrail."
    },
    {
      "path": "scripts/common/New-KitCapabilityConsistencyReport.ps1",
      "category": "script",
      "required": true,
      "hash": "48cb55b7e08e9d33066fc003078f3e0f3e85e0bdf1e2e080796c7e3998e4af88",
      "reason": "Capability consistency report generation feeds static evidence."
    },
    {
      "path": "scripts/common/New-KitContextPlan.ps1",
      "category": "script",
      "required": true,
      "hash": "3d1bedb892218d676228b937d725c687fb64c7d1d740fffd398500f26fdbd26f",
      "reason": "Context planning report generation feeds static evidence."
    },
    {
      "path": "scripts/common/Get-KitFileHash.ps1",
      "category": "script",
      "required": true,
      "hash": "31fad619dccc118cdda52fd2b8d3df710f75b7a199dbf05dfea3895c7c0e9279",
      "reason": "Build lock hash helper computes immutable input digests."
    },
    {
      "path": "scripts/common/Get-KitBuildLock.ps1",
      "category": "script",
      "required": true,
      "hash": "0088197ec329363e20db1c6ec0661252e077cffeaec2093c52d2caaec941561c",
      "reason": "Build lock loader enforces manifest parsing and duplicate path checks."
    },
    {
      "path": "scripts/common/Test-KitBuildLock.ps1",
      "category": "script",
      "required": true,
      "hash": "7f254183dc2bacab9566efbe3b760d7a9aa143dbbab89521770664ced97e9c03",
      "reason": "Build lock validator checks hashes and watched files."
    },
    {
      "path": "scripts/common/New-KitBuildLockReport.ps1",
      "category": "script",
      "required": true,
      "hash": "5d2583d3006acbc3d3a6e95ad5b066a36eb8191ff89d50f9f01b82317698dd65",
      "reason": "Build lock report builder produces CI and review evidence."
    },
    {
      "path": "scripts/validate/Test-BuildLock.ps1",
      "category": "script",
      "required": true,
      "hash": "5da3071ef6a04fac9b47120ef85a3fce3d3557dd55203c72be13d82fcc0ada33",
      "reason": "Build lock validate entrypoint writes explicit reports and exit codes."
    },
    {
      "path": "manifests/software.json",
      "category": "manifest",
      "required": true,
      "hash": "a7e21c5e22935ea0846e39af1a4628b1aadb2dc17774bd251fce55ee736dc8c7",
      "reason": "Ensure-State software manifest is a trusted desired-state ledger."
    },
    {
      "path": "schemas/software.schema.json",
      "category": "schema",
      "required": true,
      "hash": "600f699aa98625366cb68321d150c19caa858dc4f0ee2b1fa490dcb3cf7e1f26",
      "reason": "Ensure-State software schema constrains desired-state software entries."
    },
    {
      "path": "manifests/services.json",
      "category": "manifest",
      "required": true,
      "hash": "18e63b9522540c4da7b4aad05322ce261be015fe7b37a4252532269fc02e773c",
      "reason": "Ensure-State services manifest is a trusted desired-state ledger."
    },
    {
      "path": "schemas/services.schema.json",
      "category": "schema",
      "required": true,
      "hash": "bc4215b65adab2594c89106e6506a4b0399f503534cebd75a157d8bc532fb687",
      "reason": "Ensure-State service schema constrains desired-state service entries."
    },
    {
      "path": "scripts/common/Resolve-KitSoftwareState.ps1",
      "category": "script",
      "required": true,
      "hash": "7294922ab51731e4e489ba890ca1e8a6eb33f1199a4e0719fb5b4b2d30c100ac",
      "reason": "Ensure-State software resolver converts fixture or current data into reviewable state."
    },
    {
      "path": "scripts/common/Resolve-KitServiceState.ps1",
      "category": "script",
      "required": true,
      "hash": "60892a425ffc0c246815da61802f5a68a2ce08a78f8c1261bad5ef83e4857b81",
      "reason": "Ensure-State service resolver converts fixture or current data into reviewable state."
    },
    {
      "path": "scripts/common/New-KitEnsureStatePlan.ps1",
      "category": "script",
      "required": true,
      "hash": "3b575c8ee66ba7f6d73bcb5ec425683026c023e1d61ceef0521b60cc1e5d22a2",
      "reason": "Ensure-State plan generation is trusted CI evidence for convergence review."
    },
    {
      "path": "scripts/common/Test-KitEnsureState.ps1",
      "category": "script",
      "required": true,
      "hash": "f5071bc6825beed29194a1fba7e10c9dad00eca9739ef2000feb2c3e28c898b8",
      "reason": "Ensure-State validation maps plan items into passed, manual, or failed evidence."
    },
    {
      "path": "scripts/common/New-KitEnsureStateReport.ps1",
      "category": "script",
      "required": true,
      "hash": "e213cb71b5c152dd589783afbac0c53ccb033ce0a92d0859ac8907b95c180d0a",
      "reason": "Ensure-State report generation produces explicit JSON review evidence."
    },
    {
      "path": "scripts/validate/Test-EnsureState.ps1",
      "category": "script",
      "required": true,
      "hash": "2b30922fc5da48eb05f133ae60542b936dd0f27e0fef189ceb75c2162c955a8f",
      "reason": "Ensure-State validate entrypoint writes explicit reports and exit codes."
    },
    {
      "path": "scripts/validate/Test-ProjectConfig.ps1",
      "category": "script",
      "required": true,
      "hash": "56d3a725c597795e564ab2f97fda0aa90e021ad6db7d1f009d7a7af279a7c115",
      "reason": "Project config validation includes the user experience restore manifest/schema pair."
    },
    {
      "path": "tests/pester/BuildLockSchema.Tests.ps1",
      "category": "test",
      "required": true,
      "hash": "a71f9efc9f39e310ed43d0d3efbe94b217c4dffe52c493e8d76d494b983e364a",
      "reason": "Build lock schema tests guard manifest structure."
    },
    {
      "path": "tests/pester/BuildLockHash.Tests.ps1",
      "category": "test",
      "required": true,
      "hash": "b6a89266cab2dcf1ca2c82d415dc24169f7c227730c24a22bd98192ce75cd267",
      "reason": "Build lock hash tests guard deterministic digest behavior."
    },
    {
      "path": "tests/pester/BuildLockValidation.Tests.ps1",
      "category": "test",
      "required": true,
      "hash": "54912d397e3afd6679f5d7268c664367ada46535c24a2418000429dfe5edb779",
      "reason": "Build lock validation tests guard missing, mismatch, and watched-file behavior."
    },
    {
      "path": "tests/pester/BuildLockReport.Tests.ps1",
      "category": "test",
      "required": true,
      "hash": "68f4edb1f9270b4462abaf508cca24e149590aebf9ee6b532195ff7acc581dcc",
      "reason": "Build lock report tests guard report evidence structure."
    },
    {
      "path": "tests/pester/Issue12BuildLock.Tests.ps1",
      "category": "test",
      "required": true,
      "hash": "9c78cce1b34023bb63c4e6f4c70a8ac5b4f7afdc79714ef2533d7ca020df86f3",
      "reason": "Issue 12 guardrail tests keep CI, docs, and safety boundaries wired."
    },
    {
      "path": "tests/pester/EnsureStateSchema.Tests.ps1",
      "category": "test",
      "required": true,
      "hash": "a79491045bd03daa32a39eb2debff4880da044b2701401104d2c06acf2718ab5",
      "reason": "Ensure-State schema tests guard manifest structure, registry wiring, and build lock coverage."
    },
    {
      "path": "tests/pester/EnsureStatePlan.Tests.ps1",
      "category": "test",